Column1,entry,score
50,Life is difficult and I am up to the challenge but am not overly optimistic or pessimistic in my goals. Time will tell if I am able to achieve this goal but I know that for a positive future I need to maintain my goals. There is no positive or negative outcome in the immediate future that will dictate where my life goes from here. I am just trying to maintain a neutral journey on the way to happiness as it comes with time.,6
51,The new year is coming and I will continue to stay on the path that I am on. I hope everything works out. I am anxious about what is to come but I think it will be okay. I am not expecting anything dramatic out of the coming months.,4
52,"I'm Ok but I guess I just kinda feel like I didn't get much done today. It's fine though, not everyone is completely productive every single day.",5
53,The world today is going through a lot and my plans have been side tracked. I think everything will be okay and this will all be over eventually though. Today was good as I studied and cleaned the house. I was productive today which made me happy. This virus has made everything very difficult. ,4
54,"Christmas has just happened and it was a different holiday this year. Due to circumstances, families were not able to get together as normal and if they did, had to social distance and wear masks. Next Christmas should be different as the vaccine rollout continues.",6
55,"I don't have much to do this afternoon but that isn't a big deal.  I'll probably do some laundry after I have lunch.  My apartment could use some cleaning too. Overall, it's not bad to have a slow afternoon.",5
56,I had an ok day today. I ended up working all day and managed to spend some time outside but the weather was not the best. I also got to watch my favorite show later on in the evening. I made myself dinner but I ended up burning it a little but it tasted ok.,5
57,We are at a crossroads regarding the pandemic. Things could het better. Things could get worse. It could possibly just stay the same for awhile.,5
58,"A cold front hit yesterday and we are on the lake. I don't mind the rain outside too much because it makes for a beautiful view but it could be a bit sunnier. Nobody is awake before 12 unless they are working and I typically wake up around 8. This gives me four hours to myself and the gloomy view, I don't feel any emotion too severely at this time. Just me and the gloomy view. ",7
59,I think the job interview went okay but I could have done better. I stumbled over some questions but at the same time I answered most of their questions well. There will always be other opportunities for me as well. I've just got to keep my head up and keep at it.,6
60,Today I need to get all of my chores done. I plan on picking up my husband from work and may end up getting groceries on the way home. If he is hungry we will stop at chic-fil-a. ,5
61,I am visiting family today. We will be making lots of food. We will be watching movies.,8
62,I woke up this morning feeling sick. I will take over the counter meds. I will drink plenty of fluids and rest. I will make a doctor appointment if it gets worse. ,5
63,I had a lot of ups and downs this year but i survived.,5
64,"Well, it's been a hell of a year and I am expected to work until 5 PM today. My bosses are asses when it comes to holidays. Year before last, I worked my ass off to prepare my place to receive a renter, moving everything I had in my bedroom out, creating a studio for myself, and finding a part time job outside my home, to supplement my disability income. Then the pandemic hit, and everything I did went out the window. I had to rethink everything, go back to the drawing board and started working full time, despite having multiple chronic conditions and turning age 65 this year. Frankly, I feel like I have lived the hardest life a person could live, and that I am destined to spend the rest of my life in servitude, alone like a dog. ",3
65,"In August, my wife and I had to leave her parents' home where we had been staying. We had high hopes of saving up for a vehicle and starting to travel. Because we work remotely, we can do our work on the road or from anywhere we like. But in five months, we have not yet been able to save up for a car. The only ""traveling"" we have done is back and forth to Wal-Mart or to get food. The only sights we have seen is the interior of our crappy hotel room. I am not sure we will ever be able to get ahead enough to purchase a vehicle and start traveling as we intended.",2
66,"Today I have to start work early, but I'll be able to watch the sun come up! I hope the meeting goes well - we've been having some problems with [REDACTED] lately, it's like they are trying to let stuff fall through the cracks and we don't have time to go back and fix everything right now when the event is in one week. I also don't like how they stick their fingers in everyone else's business and say they're going to take care of things and then just ""forget"". If they would just relinquish some control, I think everyone would be in a better position.",2
67,"Finals week was pretty bad. While I felt confident on my first exam, the second exam made me feel like I’ve learned nothing during the course. I somehow still managed an A- in the class, but my expectations were much lower, and I hate thinking that I did poorly when I studied a ton. The rest of that week I felt like I did nothing. I was basically in a depressive state when I just watched tv and didn’t really get anything accomplished. I really don’t want to feel like that ever again.",2
68,"I found out today that my Grandpa tested positive for COVID. I feel sick to my stomach, because I don't know if he'll be able to handle it. I keep hoping that he won't have it bad, but he is so at risk to have a serious case. I wish I lived closer, but I guess that wouldn't even really do anything, because I still wouldn't be able to see him. I don't even know how to reach out to him about it, because it wasn't my grandpa and grandma who told me, and they don't know that I know. ",2
69,"2020 sucked. I couldn't travel at all, which is something I had looked forward to throughout the last 3 years of college. I told myself that when I got into med school and graduated college, I would travel the world. Because of COVID, I didn't get to do that. I also couldn't get the watch I wanted for graduation because COVID reduced production of a lot of luxury goods. I also dislike online learning and virtual school. This year was terrible.",2
70,"It is only downhill from here.  I lost a year in the prime of my life to this pandemic and I am probably going to lose more than that.  Even if I usually travel or go out often, I missed out on all the opportunities that would have been there this year.  As I get older everything will just start to pass me by and soon I will be stuck at home as my friends all get married and move on with their lives.",3
71,"Things have really been awful lately. It seems like everything that could go wrong has gone wrong. Things tend to come in waves, good and bad. I'm dealing with the bad right now. I got hit pretty hard financially and right now that's one of the worst things that could happen. I like to try to see the light at the end of the tunnel but there isn't much light to look for right now. ",2
72,"If I continue to let my anxiety control how I feel about life, 2021 will not be a great one for me. Any and everything can go wrong when it comes to my goals. Life is very unpredictable and you can never prepare for the worst to happen. My biggest fear is that I do not become financial stable and I have to live paycheck to paycheck. I am also afraid of contracting COVID-19. ",5
73,"I ate a ton of food and now I feel really bloated and fat. I looked in the mirror and I can see that my stomach is so much fatter than before. I weighed myself and I'm about 10 pounds heavier as well. I really should exercise more. If I don't, say goodbye to getting a girlfriend. Nobody is ever gonna love a fat guy unless they're rich. And I am definitely not rich. ",5
74,sothings i hate when people do talk with there mouth full. some things we should not do i also do like people talking back to odler peopl i have learned in my life. working at work sucks i hate the long hours and i hate the people i work with i just want to stay home. i would wake up and think to my self ugs why do i have to go in for one more day at work.,1
75,"I have had a nasty day today, I woke up tired. I then went out to get a cup of disappointing coffee, everything is going to be bad. I have some important tasks to get done soon, they probably won't they all go well. I still haven't heard back from some opportunities, I'm sure they won't reach back. Everything is terrible.",2
76,"I had trouble starting up my car today. It sputters and I have to push the ON button multiple times before it finally starts. To make matters worse, the right headlight went out too. Its probably because I hit that huge pothole on the new route I was trying on the way home. Not looking forward to that repair bill ",2
77,"Last night at the party, I went to the bathroom twice to vomit. However, not much came out of my system although I tried my best to force it out. After a little came out, I felt a little better and was able to comfortably go to sleep. I woke up a little late and signed onto work a little late because of it. ",3
78,"I feel extremely tired. I did not get a lick of sleep last night and I just want to pass out for the next 6 hours. I also thing my mother is judging me for staying up late as well as gaining weight recently so I've not been feeling the best mentally. I hope that the day gets better, kinda sucks right now. ",1
79,"Life is shit. What is the point of trying when it will all fall apart anyway. I don't believe that anything positive will come out of all the effort i put in. Why bother trying when the outcome will always be negative, at the end of the day I am still the same crappy person that can't accomplish anything.",0
80,I am frustated with how things have been going. I am having a hard time affording food and earning money. I have lost so much work and it is driving me crazy. I am hungry for so much more out of life. I don't know what to expect next. Life is so scary right now. I just want to feel secure and content.,1
81,"I just feel so...stuck. Lost and confused. I don't know what to do anymore and I feel like I've lost everything close to me and I don't know how to find solace in anything anymore. I wish I could open up and talk about my feelings to someone but even if I could trust anyone, I just don't know how. ",2
82," I dont feel that anything is going to change. My board exam is hanging over my head and I feel that there is no chance of me passing. This virus will never end, so many people do not wear masks and put others at risk. Everyone is in for alot more hardships. The future does not look bright. ",1
83,This winter has been especially tough with social distancing. Staying in one place all day every day has made it tough to enjoy this time of year. Plus the cold makes it miserable and my allergies really act up with the heat being turned on. I'm not sure when winter is ever going to end.,2
84,This day couldn't get much worse.  I'm done working already so I have the rest of the day with nothing to do.  I'm already so bored! Why does my life have to suck so much. I wish I could find a job where I could make more money and not have so much free time on my hands.,1
85,I had a terrible day at work today and I ended up messing a few orders. I had no energy at all and it was miserable outside all day. I went for a walk but ended up spraining my ankle. I ended up eating a small meal for dinner and it gave me a stomach ache. ,1
86,I am worried we are not doing enough fast enough regarding the pandemic. Some people still do not wear masks or social distance. It could be up to 6 months before I am immunized. I worry I may get Co-vid before I can get vaccinated.,1
87,"Last night was a terrible night for me. I basically had a panic attack in the restroom. I was scared that people could hear me, I was sure they could hear me. So I was trying to be quiet, quiet breathing quiet panicking.",4
88,That job interview was terrible. I shouldn't have even bothered to go in. I am so under qualified for the position. This was the only thing I had lined up what am I supposed to do now. ,2
89,I feel like we can never get ahead financially. All we have to look forward to is more debt. I don't think things will ever get better. I really wish I could have a different life. ,0
90,There is a new strain of COvid as the new year rolls around. The weather is getting colder and getting out is getting harder. ,6
91,I woke up this morning feeling sick. I feel rotten! I don’t have time for this! How long is this going to last? This sucks!,1
92,This is as bad as life can get. I've lost so much. I cant ever get past this.,0
